number,gt_snippet,whisper_snippet,type,variant,score,dataset,folder
57,see a large retrofit opportunity listen were already were delivering 57 67 systems to another a a very new demand for,see a large thank you listen were already delivering 5 7 6 7 systems to another very new demand for,wrong,whisper-large-v3-turbo,83.87096774193549,combined_21,4394084
3,definitely margin growth in 2021 as we outlined in that 3 day plan our threeyear plan sorry our next question is,control and definitely margin growth in 2021 as we outlined in our threeyear plan sorry and our next question is,wrong,whisper-large-v3-turbo,90.56603773584906,combined_21,4397829
6,50 and online spending was up 22 similarly for the 6 week holiday period marketwide instore traffics fell between 34 and,50 and online spending was up 22 similarly for the sixweek holiday period marketwide instore traffic fell between 34 and,wrong,GPT-4o mini Transcribe,97.5,combined_21,4397829
2020,with the final transaction set to close in our fiscal 2020 fourth quarter these efforts will help fund our transformation and,with the final transactions set to close in our fiscal 2024th quarter these efforts will help fund our transformation and,wrong,GPT-4o mini Transcribe,95.04132231404958,combined_21,4397829
5,demand comp growth of 49 year over year during the 5 day holiday period from thanksgiving to cyber monday this growth,demand comp growth of 49 year over year during the fiveday holiday period from thanksgiving to cyber monday this growth,wrong,GPT-4o mini Transcribe,96.58119658119658,combined_21,4397829
151,i think i think last year youryour transaction value was 151 or maybe 2017 was 151 billion cds i dont think,i think i think last year your your transaction value was a 100 and fiftyone or maybe 2017 was a,wrong,whisper-small,88.0,combined_22,2020-03-0230487MTN-Ghana-2019-Annual-Results-Call
66,earnings before interest tax depreciation and amortization this grew by 66 with a year on year ebitda margin expansion of 13,earnings before interest tax depreciation and amortization this grew by 6 with a year on year ebitda margin expansion of,wrong,GPT-4o mini Transcribe,99.16666666666667,combined_22,2020-03-0230487MTN-Ghana-2019-Annual-Results-Call
1489,when you you you check it under ifrs 16 was 1489 and under ias 17 is 1397 so so the that,when you you you check it on the ifr 16 was 1.489 and on the ias 17 is 1.397 so,wrong,whisper-small,89.03225806451613,combined_22,2020-Annual-Results-Call-Recording
12.5,is the positioning yeah it has no effect on the 12.5 because that 1 is locked per the ipo initial ipo,that is the position where it has no effect on the 2.5 because that 1 is not a paid ipu,wrong,whisper-small,81.92771084337349,combined_22,2020-Annual-Results-Call-Recording
400,so yes weve continued a p2p the free p2p gh 400 daily weve continued that so far in 2021 and in,statements and so yes weve continued the p2p the free p2p for haggagana cities daily weve continued that so far,wrong,whisper-small,77.89473684210526,combined_22,2020-Annual-Results-Call-Recording
1489,when you you you check it under ifrs 16 was 1489 and under ias 17 is 1397 so so the that,when you check it on the ifrs 16 was 1.489 and under ias 17 is 1.397 so that is our,wrong,whisper-large-v3-turbo,83.9506172839506,combined_22,2020-Annual-Results-Call-Recording
3.5,come back on the data usage per subscriber is that 3.5 to 4 gb per mobile subscriber or is that also,to come back on the data usage per subscriber is that threeandahalf to 4 gigs per mobile subscriber or if,wrong,whisper-large-v3-turbo,84.0,combined_22,2020-Annual-Results-Call-Recording
328,in our digital journey and were pleased to report a 328 surge in the number of active subscribers owing to some,in our digital journey and were pleased to report a 38 surge in the number of active subscribers or into,wrong,whisper-large-v3-turbo,97.0873786407767,combined_22,2020-Annual-Results-Call-Recording
16,have happened you know 1 weve increased subs by about 16 but weve also seen a significant increase in usage in,have happened you know 1 weve increased subs by about 60 but weve also seen a significant increase in usage,wrong,GPT-4o mini Transcribe,99.06542056074767,combined_22,2020-Annual-Results-Call-Recording
12,completely the best liquidity position with 20 of the last 12 months revenue moving on to our head test at the,that comes with the deposition which is 20 of last months revenue moving out to a head test at the,wrong,whisper-small,78.02197802197803,combined_22,4329526
85.2,increased by 17.2 and traffic by 20 load factor reached 85.2 this is 1.7 head points higher above the fourth quarter,and traffic by 20 load factor reached 8500 this is 1 from 7 percentage points higher above the fourth quarter,wrong,whisper-large-v3-turbo,89.85507246376811,combined_22,4329526
67,the cabins of our fleet and we are already flying 67 aercap with the new cabins leading to significant improvements in,our fleet and we are already flying 6 or 7 archives of the new cabins leading to significant improvement in,wrong,whisper-large-v3-turbo,90.99526066350711,combined_22,4329526
79,this is composed by a 2 target for international business 79 for domestic brazil and 68 for domestic operations we are,this is composed by a 0 to 2 target for international business 7 to 9 growth for domestic brazil and,wrong,GPT-4o mini Transcribe,91.30434782608697,combined_22,4329526
7,worldwide we already relocated our flights to jfk from terminal 7 from terminal 8 sorry to terminal 4 to better serve,than 300 destinations worldwide we already reallocated our flights to jfk from terminal 8 to terminal 4 to better serve,wrong,GPT-4o mini Transcribe,88.78504672897196,combined_22,4329526
68,2 target for international business 79 for domestic brazil and 68 for domestic operations we are also correcting cargo capacity to,0 to 2 target for international business 7 to 9 growth for domestic brazil and 6 to 8 for domestic,wrong,GPT-4o mini Transcribe,88.63636363636364,combined_22,4329526
300,fourth quarter yes its likely be low 400 billion around 300 390 billion okay understood and are there any other 1,the port quarter yes slightly below 4 100 billion around 380390 billion okay understood and are there any other 1,wrong,whisper-small,92.3076923076923,combined_22,4351517
2020,business increased significantly by 23.1 to 58.2 trillion driven by 2020 22.3 increase in data and 29 in in 2019 digital,engines digital business increase significantly by 23.1 to 58.2 trillion driven by 22.3 increase in data and 29 in detail,wrong,whisper-small,91.55555555555556,combined_22,4351517
204000,over 4g biz by the end of 2019 telkomsel around 204000 units 76.3 of which were 3g and 4g which supported,on a vts to target around 200000 and 2000 units 76.3 of which were 20 and 40 to support data,wrong,whisper-small,71.60493827160495,combined_22,4351517
0.1,of 2.1 3.7 and 1.0 respectively ebitda margin improved by 0.1 percentage point to 54 amidst the declining legacy business ladies,of 2.1 3.7 and 1.0 respectively ebitda margin improved by 0.9 percentage point to 54 amidst the claiming legacy business,wrong,whisper-large-v3-turbo,96.66666666666667,combined_22,4351517
200,right now only about 50000 of the rest is actually 200 you know 5000 you can actually growing of and also,right now only about 50000 of the community as this and the rest is actually data which is you know,wrong,whisper-large-v3-turbo,74.07407407407408,combined_22,4351517
33.1,while in mobile business the consolidated business grow strongly by 33.1 and successfully legacy business to decline ladies and gentlemen during,in mobile business telekomsel business grew strongly by 23.1 and successfully compensated legacy business to decline ladies and gentlemen during,wrong,GPT-4o mini Transcribe,88.65248226950355,combined_22,4351517
0.1,of 2.1 3.7 and 1.0 respectively ebitda margin improved by 0.1 percentage point to 54 amidst the declining legacy business ladies,and 1.0 respectively ebitda margin improved by 0.9 points to 54 amidst declining legacy business ladies and gentlemen we continue,wrong,GPT-4o mini Transcribe,87.44588744588745,combined_22,4351517
204000,over 4g biz by the end of 2019 telkomsel around 204000 units 76.3 of which were 3g and 4g which supported,over 4g base by the end of 2019 telecom service on average total around 212000 units 76.3 of which were,wrong,GPT-4o mini Transcribe,81.31868131868131,combined_22,4351517
135.63,our telkom 3.7 year on year growth in revenue to 135.63 idr while ebitda and net income grew by 9.5 and,3.7 year on year growth in revenue to rp125 63 trillion while ebitda and net income grew by 9.5 and,wrong,GPT-4o mini Transcribe,92.14659685863874,combined_22,4351517
100,term contract electricity volumes so last july ep brazil around 100 million realized difference the covid account which reinforces the financial,term contract electricity volumes so last july ep brazil got essentially about 600 million reeyes referring to the covid accounts,wrong,whisper-small,80.99173553719008,combined_22,4372696
20,the forex in fact namely the brazilian real which depreciated 20 versus the euro within renewables and despite the 80 increase,before x in fact namely the brazilian real which depreciated versus the euro within renewables and despite the 80 increase,wrong,whisper-small,97.54098360655738,combined_22,4372696
2,building this year but weve already been getting close to 2 gigawatts so within you know 1.5 to 1.9 type range,building this year but wed already be getting close to so weve been you know 1.5 to 1.9 type range,wrong,whisper-small,79.59183673469387,combined_22,4372696
100,term contract electricity volumes so last july ep brazil around 100 million realized difference the covid account which reinforces the financial,term contract electricity volumes so last july edp brazil got essentially around 600 million reais referring to the covid account,wrong,whisper-large-v3-turbo,84.29752066115702,combined_22,4372696
719,times in june 2020 to slightly above the 3.6 and 719 clearly below the the 4.1 sold last year from year,times in june 2020 just slightly above the 3.6 in 7.19 and clearly below the 4.1 shown last year year,wrong,GPT-4o mini Transcribe,87.30964467005076,combined_22,4372696
450,of this year thank you very much it is already 450 and because we dont have enough time we will take,this year thank you very much it is already 4.50 and because we dont have enough time we will take,wrong,whisper-small,99.48717948717949,combined_22,4420696
1722.8,is on the groups ga expense q1 group ga was 1722.8 billion won which is up 18.1 year on year seeming,is on the groups gna expense q1 group gna was 1722800000000 won which is up 18.1 year on year seeming,wrong,whisper-large-v3-turbo,90.0,combined_22,4420696
22,the loan demand is quite solid each year and in 22 in april it seems that the numbers are quite different,loan demand is quite solid each year and in q2 in april it seems that the numbers are quite different,wrong,GPT-4o mini Transcribe,99.00990099009901,combined_22,4420696
100,changes as of late last year has secured more than 100 10 million digital customers which is around 44 of the,changes as of late last year has secured more than 110 million digital customers which is around 44 of the,wrong,GPT-4o mini Transcribe,97.16981132075472,combined_22,4420696
100,and the uk in terms of the doses administered per 100 habitats as of april 30 8.1 million people in chile,the uk in terms of the doses administered per 180 habitants as of april 30 8.1 million people in chile,wrong,whisper-small,98.52216748768473,combined_22,4423872
125,of 2022 pre vi pre viously while we see only 125 basis points rate hikes this year in the last meeting,of 2022 pre viously while we see only 1 25 basis points rate hike this year in the last media,wrong,whisper-small,91.71270718232044,combined_22,4423872
2,economic recovery fronts the government announced an expansion to the 2 year corporate fund by over 6 billion thats 2 of,on the economic recovery fronts the government announced an expansion to the twoyear covid fund by over 6 billion us,wrong,whisper-small,89.38053097345133,combined_22,4423872
1.54,slide 8 we show that our loan portfolio grew by 1.54 in the first quarter which is broadly in line with,slide 8 we showed that our loan portfolio grew by 1.4 in the first quarter which is broadly in line,wrong,whisper-large-v3-turbo,98.47715736040608,combined_22,4423872
1.54,slide 8 we show that our loan portfolio grew by 1.54 in the first quarter which is broadly in line with,slide 8 we show that our loan portfolio grew by 1.4 in the first quarter which is broadly in line,wrong,GPT-4o mini Transcribe,98.96907216494846,combined_22,4423872
81,centers and including the potential for future b development about 81 in the still in the progressing of the scale and,center and including the potential for future development as mentioned also by 1 in the still in the the progressing,wrong,whisper-small,86.63594470046083,combined_22,4426736
2023,let me confirm late 23 you mentioned yeah yeah early 2023 early so basically we have some data centers i its,so let me confirm late 23 you mentioned yeah early 20 days so basically we have some data centers which,wrong,whisper-small,90.29126213592234,combined_22,4426736
22,yeah number 2 i looked at the the case of 22 actually for the quarter 4 we implement the basic second,for number 2 elected to the base case 72 actually for the course of therefore we implement the pshk72 so,wrong,whisper-small,72.27722772277228,combined_22,4426736
72,for q4 actually coming from the implementation of the psak 72 which is related with ifrs 15 so we were doing,for q4 actually coming from the implementation of the psi k752 which is related with the mps 15 so we,wrong,whisper-small,92.92929292929293,combined_22,4426736
2023,let me confirm late 23 you mentioned yeah yeah early 2023 early so basically we have some data centers i its,let me confirm late 23 you mentioned yeah early 20s so basically we have some data centers which is under,wrong,whisper-large-v3-turbo,87.61904761904762,combined_22,4426736
81,centers and including the potential for future b development about 81 in the still in the progressing of the scale and,center and including the potential for future development as i mentioned also by 1 in the still in the progressing,wrong,whisper-large-v3-turbo,87.44186046511628,combined_22,4426736
2,hi good afternoon management thanks for the opportunity i have 2 questions actually so just bear with me my first question,good afternoon management thanks for the opportunity i have 3 questions actually so just bear with me my first question,wrong,GPT-4o mini Transcribe,99.15966386554622,combined_22,4426736
2.5,in terms of the switch q1 2021 revenue was nearly 2.5 times better than the first quarter of 2019 this year,2020 revenue wise was nearly 2 and a half times better than the the first quarter of 2019 this year,wrong,whisper-small,86.66666666666667,combined_22,4432298
950,and 40 millions reaching a total of 1 billion and 950 million moving to the equity and liability side the first,and 40 million zlatik reaching a total of 1 billion and 915 million losses moving to the equity and liability,wrong,whisper-small,91.70731707317074,combined_22,4432298
3,our youtube channel lets get started please jump to slide 3 improving cyberpunk 2077 remains our top priority since the beginning,youtube channel lets get started please jump to slide suite improving cyberpunk 2077 remains our top priority since the beginning,wrong,whisper-large-v3-turbo,97.63779527559055,combined_22,4432298
2021,of the witcher 3 in terms of the switch q1 2021 revenue was nearly 2.5 times better than the first quarter,of the witcher 3 and nintendo switch q1 2020 revenuewise was nearly 2 and a half times better than the,wrong,whisper-large-v3-turbo,81.44329896907216,combined_22,4432298
14,value of provisions among the short term liabilities increased by 14 millions together with the decrease of long term provisions this,liabilities increased by the end of the year 40 million losses together with the decrease of long term provisions this,wrong,whisper-large-v3-turbo,86.66666666666667,combined_22,4432298
135140,of digital revenue per unit to be somewhere in the 135140 kind of sloppy sort of range when i look at,of digital revenue per unit to be somewhere in the 135 140 kind of sloppy sort of range when i,wrong,GPT-4o mini Transcribe,99.46524064171123,combined_22,4432298
3,2021 the total value of our cash from deposits in 3 months increased by 1 billion and 40 millions reaching a,the total value of our cash bank deposits and tbonds increased by 1 billion and 14 million zlotys reaching a,wrong,GPT-4o mini Transcribe,87.20379146919431,combined_22,4432298
140,last years figure mainly impacted by the dividend payment of 140 million euros in q2 and implying a total net of,last years figure mainly impacted by the dividend payment of 114 million euros mq2 and implying a total net debt,wrong,whisper-small,96.36363636363636,combined_22,4443871
12,in q2 this year positively impacted by sonae im score 12 evaluations and the dividends increase the dividends received from the,in q2 this year positively impacted by the iam for toll evaluations and the dividends increased from direct state north,wrong,whisper-large-v3-turbo,82.1917808219178,combined_22,4443871
43,year on year overall decreased by 2 million euros to 43 million euros in q2 at more than double compared to,year on year overall direct results increased almost 50 million euros in q2 55 million euros and more than 17,wrong,GPT-4o mini Transcribe,70.09345794392523,combined_22,4443871
21,likeforlike swing between q1 and q2 reflects the comparison with 21 2020 when the impacts of the pandemic hit the performance,likeforlike swing between q1 and q2 reflects the comparison with 2020 when the the impacts of the pandemic keep the,wrong,whisper-small,93.85964912280701,combined_22,4443920
2,do you think your profitability in poland would be like 2 years from now or midterm versus free retail tax profitability,you think youre profitability in poland will be like 3 years from now on midterm versus 3 retail tax profitability,wrong,whisper-small,92.10526315789474,combined_22,4443920
50,people inside the stores being relaxed from 1 person per 50 square meters to 1 person 10 per 10 square meters,people inside the stores being relaxed from 1 person per 15 square meters to 1 person per 10 square meters,wrong,whisper-small,96.22641509433963,combined_22,4443920
4.4,2020 top line was up by 23 for point for 4.4 and likeforlike was at 17.7 also including online sales ecommerce,discontinued in july 2020 top line was up by 23.4 and likeforlike was at 17.7 also including online sales ecommerce,wrong,whisper-small,92.15686274509804,combined_22,4443920
36.4,as percentage of net sales msda improved from 42.4 to 36.4 due to costcontrol initiatives through the excellence ccu program in,percentage of net sales improved from 69 to 54.4 due to efficiencies from the excellencia ccu program all together ebitda,wrong,GPT-4o mini Transcribe,71.900826446281,combined_22,4446796
570,positively 45 million 272 million higher than first quarter and 570 million higher than the same period of last year this,45 million 272 million higher than first quarter and 517 million higher than the same period of last year this,wrong,GPT-4o mini Transcribe,99.0909090909091,combined_22,4449269
0.9,the first half of 2021 our adjusted ebit margin was 0.9 and our adjusted ebitda margin was 9.2 both well above,first half of 2021 our adjusted ebitda margin was 3.9 and our adjusted ebitda margin was 9.2 both well above,wrong,GPT-4o mini Transcribe,98.13084112149532,combined_22,4449269
4723000000,the net result of the capital group was up to 4723000000 the main driving factor was again increased revenue the change,of the the capital group was up to 4723 million the main driving factor was again increased revenue the change,wrong,whisper-small,91.58878504672897,combined_22,4450488
1200,this still summertime afternoon we have over we already passed 1200 we have a few pieces of good news about the,this still summer time afternoon we have already we already passed 12 we have a few pieces of good news,wrong,whisper-small,94.11764705882352,combined_22,4450488
42,the revenue the revenue of the capital group were up 42 on a year to year basis and it is important,with the revenue the revenue of the capital group was up 32 on a yeartoyear basis and it is important,wrong,whisper-large-v3-turbo,95.38461538461537,combined_22,4450488
42,the revenue the revenue of the capital group were up 42 on a year to year basis and it is important,with the revenue the revenue of the capital group were up 32 on a yeartoyear basis and it is important,wrong,GPT-4o mini Transcribe,97.95918367346938,combined_22,4450488
22.4,margin for the first 6 months of the year of 22.4 despite an even softer third quarter had following historical seasonality,margin for the first 6 months of the year of 32.4 despite an even softer thirdquarter head following historical seasonality,wrong,whisper-small,98.3739837398374,combined_22,4450779
42.4,the year totaled 190 6 million reals resulting in a 42.4 accumulated margin finally adjusted net income was 36.4 million for,year totaled r190 6 million resulting in a 32.4 accumulated margin finally a just an ad income was 36.4 million,wrong,whisper-small,89.1891891891892,combined_22,4450779
20,an adjusted ebitda for the quarter of 72.6 million reals 20 below the second quarter last year with a 28.2 ebitda,an adjusted ebitda for the quarter of 72.3 million reais 28 below the second quarter last year with 28.2 ebitda,wrong,whisper-small,95.4954954954955,combined_22,4450779
2,so by saying that we expect this to be a 2 step recovery is not that we dont think that 60,so by saying that we expect this to be a twostep recovery its not that we dont think that 60,wrong,whisper-large-v3-turbo,95.55555555555556,combined_22,4450779
72.6,sales led to an adjusted ebitda for the quarter of 72.6 million reals 20 below the second quarter last year with,led to an adjusted ebitda for the quarter of 72.3 million reais 28 below the second quarter last year with,wrong,whisper-large-v3-turbo,97.16981132075472,combined_22,4450779
37.7,to meet the adjusted ebitda margin guidance of 35.5 and 37.7 range the forecast will improve this quarter as we collect,to meet the adjusted ebitda margin guidance of 35.5 and 37.5 range the free cash flow improved this quarter as,wrong,whisper-large-v3-turbo,93.57798165137613,combined_22,4450779
42.4,the year totaled 190 6 million reals resulting in a 42.4 accumulated margin finally adjusted net income was 36.4 million for,the year totaled 190.6 million reais resulting in a 32.4 accumulated margin finally adjusted net income was 36.4 million for,wrong,GPT-4o mini Transcribe,97.58064516129032,combined_22,4450779
189,of gmv resulted as negative 3.2 amounting to negative tl 189 million now lets have a look at our net working,as a percentage of cmv resulted as negative 3.2 amounting to negative now lets have a look at our networking,wrong,whisper-small,91.0,combined_22,4452058
15.5,performance resulted in the increase of the consolidated revenue from 15.5 last year to 18.5 indihome profitability also continued to improve,received revenue from 32.5 last year to 80.5 the new profit of the day also continued to improve with a,wrong,whisper-small,76.84210526315789,combined_22,4453076
42,space yup thank you thank you for the questions and 42 megawatts capacity for our and the second question the the,states yep thank you okay thank you for the question on the utilization of this 43 megawatt capacity for our,wrong,whisper-large-v3-turbo,78.3068783068783,combined_22,4453076
18.5,increase of the consolidated revenue from 15.5 last year to 18.5 indihome profitability also continued to improve with ebitda margin of,revenue from 15.5 last year to 18.1 the new problem that we can also continue to improve that every 1,wrong,whisper-large-v3-turbo,74.25742574257426,combined_22,4453076
11.7,data center contributed 713 billion in revenue or increased by 11.7 year on year to enhance our capacity currently we are,of the day or increased by the 1820 year on year who is it our capacity is currently we are,wrong,whisper-large-v3-turbo,77.84431137724552,combined_22,4453076
12,value mdi has invested in more than 50 startups in 12 countries of which 3 companies have done ipo and 6,has invested in more than 50 startups in our cloud countries of which 3 companies have done ipo and 6,wrong,GPT-4o mini Transcribe,94.35897435897435,combined_22,4453076
75,the final stage hyperscale data center will have capacity around 75 megawatts in tower business after we successfully consolidated tower assets,stage data center capacity is approximately around 45 megawatts in power business after the successful implementation of the power assets,wrong,GPT-4o mini Transcribe,74.90347490347492,combined_22,4453076
69.7,also improved to 76.8 in first half of 2021 from 69.7 in the first half last year the realignment of tower,also in 36.8 in first half of 2021 from 59.7 in the first half last year the alignment of stock,wrong,GPT-4o mini Transcribe,90.32258064516128,combined_22,4453076
1129000000,increased our financial reserves by 255 million zloty up to 1129000000 billion 129 million zloty of cash bank deposits and tbonds,the period it increased our financial reserves by 255 million zloty up to 1129 million zloty of cash bank deposits,wrong,GPT-4o mini Transcribe,84.21052631578947,combined_22,4453085
40,were not affected because those values are very close to 40 million zoty actually the cost provision was slightly bigger than,gross profits were not affected because both values are very close to 14 actually the cost provision was slightly bigger,wrong,GPT-4o mini Transcribe,85.0,combined_22,4453085
