number,gt_snippet,whisper_snippet,type,variant,score,dataset,folder
2,store base as many of you know we operate in 2 store formats our service brand stores which generate approximately 600000,store base as many of you know we operate in twostore formats our service brand stores which generate approximately 600000,wrong,whisper-large-v3-turbo,97.52066115702479,combined_21,4320211
140.2,average interest rate for the third quarter decreased by approximately 140.2 basis year over year due to lower libor and prime,average interest rate for the third quarter decreased by approximately 140 basis points year over year due to lower libor,wrong,GPT-4o mini Transcribe,96.20253164556962,combined_21,4320211
3.8,operating income for the quarter was 3 million compared with 3.8 million a year ago with operating income margin of 8.7,operating income for the quarter was 1.8 million compared with 3.2 million a year ago with an operating income margin,wrong,whisper-small,96.06986899563319,combined_21,4330115
2,period with 8.7 now lets take a look at our 2 at our business segments for mattress fabric segment sales with,period with 8.7 now lets take a look at our business segments for the mattress fabric segment cells were 33.1,wrong,whisper-small,89.52380952380953,combined_21,4330115
13,with 47 billion cash right and thats really to cover 13 billion of ge and ge capital long term debt maturities,with 47 billion cash right much for you to cover the us in billion of the ung capital long term,wrong,whisper-small,79.36507936507937,combined_21,4341191
0.72,by covid19 now lets discuss starting at continuing etf of 0.72 cents there was a 0.75 cents gain primarily related to,discuss the eps ward starting at continuing eps of 72 cents it was a 75 cent gain primarily related to,wrong,whisper-small,86.4321608040201,combined_21,4341191
1015,half of this year to the second half with another 1015 pushing into next year our power businesses are taking several,year to the second half with another 10 to 15 pushing into next year our power businesses are taking several,wrong,whisper-large-v3-turbo,98.11320754716981,combined_21,4341191
773,just over half of the year over year margin difference 773 7 max timing considering install and spare engine volumes and,just over half of the year over year margin difference 737 max timing considering install and spare engine volume and,wrong,whisper-large-v3-turbo,97.43589743589743,combined_21,4341191
0.75,starting at continuing etf of 0.72 cents there was a 0.75 cents gain primarily related to the 11.5 billion after tax,starting at continuing eps of 72 cents there was a 75 cent gain primarily related to the 11.9 billion aftertax,wrong,GPT-4o mini Transcribe,92.72727272727272,combined_21,4341191
11,the top of my head it was in the high 11 sort of close to 12 million range and theres always,probably and i dont have it off the top of my head or low 12 million range and theres always,wrong,whisper-small,77.63157894736842,combined_21,4344866
69,point and just to keep it in perspective of the 69 a little over 4 million of that impacts our current,at that point and just to keep it in perspective of the 16000000 9000000 or 4000000 that impacts our current,wrong,whisper-small,79.20792079207921,combined_21,4344866
2.20,smart commercial accounts we estimate that impact to be approximately 2.20 million we have not yet seen any appreciable change in,demand we estimate that impact to be approximately 2.2 million we have not yet seen any appreciable change in our,wrong,whisper-small,94.93087557603687,combined_21,4344866
1.90,moratorium on fees we anticipate losing fee revenue of roughly 1.90 million we have seen some decline in our commercial and,moratorium on fees we anticipate losing fee revenue of roughly 1.9 million we have seen some decline in our commercial,wrong,whisper-small,99.15254237288136,combined_21,4344866
16.90,the supreme courts decision not to take it on are 16.90 million and that we continue to collect on those and,supreme courts decision not to take an honor 16.9 million and we need to collect on those and were collecting,wrong,whisper-large-v3-turbo,86.56716417910448,combined_21,4344866
2.90,excluding this adjustment our run rate utility om was up 2.90 million or 2.60 due to higher operations and employee costs,excluding this adjustment our run rate utility om was up 2.9 million or 2.6 due to higher operations and employee,wrong,whisper-large-v3-turbo,98.23008849557522,combined_21,4344866
2.20,this quarter isrs revenue is subject to a provision for 2.20 million including interest bringing the cumulative provision at march 31,this quarter isras revenues subject to a provision were 2.2 million including interest bringing the cumulative provision at march 31,wrong,whisper-large-v3-turbo,96.21212121212122,combined_21,4344866
12.60,on slide 1 total om expenses as reported were down 12.60 million and although we have a history of cost control,slide 13 total om expenses as reported were down 12.6 million and although we have a history of cost control,wrong,GPT-4o mini Transcribe,99.07407407407408,combined_21,4344866
2.40,gas utility posted earnings of just over 144 million down 2.40 million from last year as a result of warmer weather,utility posted earnings of just over 144 million down 2.4 million from last year as a result of warmer weather,wrong,GPT-4o mini Transcribe,99.0909090909091,combined_21,4344866
3.60,no longer exists is now interoperating numbers and secondly a 3.60 million swing in returns on investments held the support on,no longer exists and is now in our operating numbers and secondly a 3.6 million swing in returns on investments,wrong,GPT-4o mini Transcribe,94.93087557603687,combined_21,4344866
796,prior year excluding effects adjusted revenues in the quarter were 796 million down 17 excluding effects and leading to a book,revenue in the quarter worth 7 100 ninety 6 million dollars down 17 excluding effects and leading to a booktobill,wrong,whisper-small,83.5820895522388,combined_21,4346818
3,the overall cost synergy target at 250 million over a 3 year timeframe at this time to remain prudent on volume,the overall cost energy target at 250 million over a threeyear time frame at this time to remain prudent on,wrong,whisper-small,94.7867298578199,combined_21,4346818
250,we think we think we want to keep it at 250 just because we think its prudent and and we think,we think we think we want to keep it at 2.50 just because we think its prudent and we think,wrong,whisper-large-v3-turbo,95.6043956043956,combined_21,4346818
110,reality is that import prices in colombia are closer to 110 if you take into account all the other markets thank,in colombia ill close it to 1 100 and ten and it takes into account over the market okay thank,wrong,whisper-large-v3-turbo,72.72727272727273,combined_21,4346923
50,we have in 84 85 of budgets and just at 50 decline french guiana was at 105 of their budget so,have suriname with 85 of budgets so just a 15 decline french bullion was at 105 of the budget so,wrong,whisper-large-v3-turbo,83.33333333333334,combined_21,4346923
80,in colombia now in terms in colombia prices are below 80 and the reality is that import prices in colombia are,in colombia now in terms of us dollars the pricing in colombia is at 200 dollars and the reality is,wrong,GPT-4o mini Transcribe,71.26436781609196,combined_21,4346923
45,market experienced a decrease in clinical and cement inputs of 45 and 56 respectively when compared to the first quarter of,the market experienced a decrease in clean cement imports of 35 and 56 respectively when compared to the first quarter,wrong,GPT-4o mini Transcribe,90.67796610169492,combined_21,4346923
9.10,which resulted into 11.70 reduction in quarter 2 and a 9.10 reduction in volumes for the first semester 2020 for sea,which resulted into an 11.7 reduction in quarter 2 and a 9.1 reduction in volumes for the first semester 2020,wrong,whisper-small,97.6958525345622,combined_21,4359732
9.10,5.90 versus pre vious year gross profit went down by 9.10 and the ebit by 18 down to chf419 million in,versus pre vious year gross profit went down by 9.1 and the ebit by 18 down to 419 million swiss,wrong,GPT-4o mini Transcribe,95.83333333333334,combined_21,4359732
6.40,injuryfree every day we also improved our energy efficiency by 6.40 compared to a 2015 baseline that is the equivalent of,home injuryfree every day we also improved our energy efficiency by 6.4 compared to a 2015 baseline is the equivalent,wrong,whisper-small,94.87179487179486,combined_21,4359971
10,for 10 sorry 50 50 million your responsibility is for 10 of that right so the its the banks that benefit,for sorry 50 fifty million your responsibility is for ten of that right so the its the banks that benefit,wrong,whisper-small,92.3076923076923,combined_21,4359971
2.10,individual businesses in select renewal rate change was up to 2.10 making the sixth consecutive quarter where renewal rate was higher,as for the individual businesses in select up to 2.1 making the sixth consecutive quarter where renewal rate was higher,wrong,whisper-small,81.86046511627907,combined_21,4360366
7.90,up to 7.9 while retention remained strong at 86 the 7.90 was up almost 4 and a half points from the,change was up to 7.9 while retention was strong at 86 the 7.9 was up almost fourandahalf points from the,wrong,whisper-small,90.625,combined_21,4360366
1.50,from the prior year quarter renewal pre mium change was 1.50 as we continue to moderate pricing given the improved inform,from the prior year your quarter renewal pre mium change was 1.5 as we continue to moderate pricing given the,wrong,whisper-small,97.19626168224299,combined_21,4360366
15,half of the year were our net charges were about 15 million bucks putting aside the investment side and and and,half of the year where net charges were about 50 million bucks putting aside the investment side and and weve,wrong,whisper-small,94.93087557603687,combined_21,4360366
84.20,mium refunds i described earlier the underlying combined ratio of 84.20 improved 9.6 points relative to the prior year quarter continuing,mium refunds i described the underlying combined ratio of 84.2 improved 9.6 points relative to the prior year quarter continuing,wrong,whisper-small,92.96875,combined_21,4360366
7.40,domestic production we achiev achieved strong renewal rate change of 7.40 while retention remained high at 83 the renewal rate change,we achieved strong renewal rate change of 7.4 while retention remained high at 83 the renewal rate change of 7.4,wrong,whisper-large-v3-turbo,95.41284403669725,combined_21,4360366
84.20,mium refunds i described earlier the underlying combined ratio of 84.20 improved 9.6 points relative to the prior year quarter continuing,refunds i described earlier the underlying combined ratio of 84.2 improved 9.6 points relative to the prior year quarter continuing,wrong,whisper-large-v3-turbo,99.23664122137404,combined_21,4360366
7.90,up to 7.9 while retention remained strong at 86 the 7.90 was up almost 4 and a half points from the,change was up to 7.9 while retention remained strong at 86 the 7.9 was up almost 4.5 points from the,wrong,whisper-large-v3-turbo,92.5531914893617,combined_21,4360366
3.60,from 1.80 billion after tax as of march 31st to 3.60 billion after tax at june 30th adjusted book value per,billion after tax as of march 31st to 3.6 billion dollars after tax at june 30th adjusted book value per,wrong,whisper-large-v3-turbo,95.52238805970148,combined_21,4360366
35,we expect that fixed income nii will decrease by approximately 35 to 40 million after tax per quarter compared to the,2020 we expect that fixed income nii will decrease by approximately to 40 million dollars aftertax per quarter compared to,wrong,whisper-large-v3-turbo,93.16239316239316,combined_21,4360366
7.40,retention remained high at 83 the renewal rate change of 7.40 was up almost 4 points from the second quarter of,retention remained high at 83 the renewal rate change of 7.4 was up almost 4 points from the second quarter,wrong,whisper-large-v3-turbo,99.06542056074767,combined_21,4360366
40,of our quantum home 2 product now available in over 40 markets during the quarter we continued to deliver new capabilities,of our quantum home 2.0 product now available in over forty markets during the quarter we continued to deliver new,wrong,whisper-large-v3-turbo,95.96412556053812,combined_21,4360366
7.70,quarter with retention of 87 renewal pre mium change of 7.70 and a 17 increase in new business as we continue,with retention of 87 renewal pre mium change of 7.7 and a 17 increase in new business as we continued,wrong,GPT-4o mini Transcribe,99.00990099009901,combined_21,4360366
107.10,as both alan and dan discussed the combined ratio of 107.10 included more than 10 points with catastrophe impacted by both,both alan and dan discussed the combined ratio of 107.1 included more than 10 points of catastrophes impacted by both,wrong,GPT-4o mini Transcribe,95.72649572649573,combined_21,4360366
1.80,quarter and accordingly our net unrealized investment gain increased from 1.80 billion after tax as of march 31st to 3.60 billion,quarter and accordingly our net unrealized investment gains increased from 1.8 billion after tax as of march 31st to 3.6,wrong,GPT-4o mini Transcribe,99.16666666666667,combined_21,4360366
9.60,is at the upper end of the allowed band of 9.60 to 11.6 allowed under our current rate agreement during the,at the upper end of the allowed band of 9.6 to 11.6 allowed under our current rate agreement during the,wrong,whisper-small,99.02912621359224,combined_21,4360674
700,the safe harbor equipment also support additional repowering opportunities including 700 megawatts of potential 2021 repowering projects which we are currently,harbor equipment also supports additional repowering opportunities including several 100 megawatts of potential 2021 repowering projects which we are currently,wrong,GPT-4o mini Transcribe,96.44012944983818,combined_21,4360674
2.50,our 30year dollardenominated bond issuance bringing the total amount to 2.50 billion which was our original target the weighted average yield,non inmediated bomb issue bringing the total amount to 2.5 billion which was our original target the weighted average yield,wrong,whisper-small,93.87755102040816,combined_21,4360717
128,units across our territories at the end of june and 128 total net new stores for the last 12 months revenues,units across our territory at the end of june and the water amendment 28 total net news source of the,wrong,whisper-small,82.16216216216216,combined_21,4360717
14.30,operations decreased 37.5 on an organic basis total revenues decreased 14.30 and income from operations decreased by 40.4 for this quarter,operations decreased 37.5 on an organic basis total revenues decreased 14.3 and income from operations decreased by 40.4 for this,wrong,whisper-large-v3-turbo,99.2248062015504,combined_21,4360717
0.8,ancillary charges related to the extraordinary payments of almost mxn8 0.8 billion agreed with the mexican tax authority as well as,is related to the extraordinary payment of almost 8.8 billion pesos agreed with the mexican tax authority as well as,wrong,whisper-large-v3-turbo,94.37229437229438,combined_21,4360717
0.8,ancillary charges related to the extraordinary payments of almost mxn8 0.8 billion agreed with the mexican tax authority as well as,ancillary charges related to the extraordinary payment of almost 8.8 billion pesos agreed with the mexican tax authority as well,wrong,GPT-4o mini Transcribe,95.3125,combined_21,4360717
15.40,24point 24.10 decline in store traffic and an increase of 15.40 in average consu customer ticket here it is also useful,24.1 decline in store traffic and an increase of 15.4 in average customer ticket here it is also useful to,wrong,GPT-4o mini Transcribe,93.39622641509435,combined_21,4360717
20,question in our backbone plan document investment figures are given 20 or 60 billion for in for for the entirety of,conclude with a hydrogen question in our backbone plan document investment figures are given 60 billion for the entirety of,wrong,whisper-small,92.01877934272301,combined_21,4361631
10,as you know in relation to peru on july 15 10 days ago 1 week ago a new prime minister was,you know in relation to peru on july 15th ten days ago 1 week ago a new prime minister was,wrong,whisper-large-v3-turbo,96.045197740113,combined_21,4361631
181,a bdi of 300 million financial expenses expenses of 1 181 million and this accounts for 65 million multiplied by exchange,expenses of 1 point 1 100 than 81 million dollars and this accounts for 65 million dollars multiplied by exchange,wrong,whisper-large-v3-turbo,83.50515463917526,combined_21,4361631
3.6,these conditions inflation pre ssures should remain low we expect 3.6 for 2020 allowing bank of mexico to quote interest rates,these conditions inflation pre ssures should remain low we expect 3.5 of the population to be affected by inflation for,wrong,whisper-small,76.05633802816901,combined_21,4363614
6075,of what we require and that could be you know 6075 of what we require you know with information that we,require and that could be you know 60 to 75 of what we require you know with information that we,wrong,whisper-small,97.87234042553192,combined_21,4363614
6,in our efficiency ratio which decreased to 40.7 on a 6 months basis the ratio improved 227 basis points year on,in our efficiency ratio which decreased to 40.7 on a sixmonth basis the ratio improved 227 basis points year on,wrong,whisper-small,97.2972972972973,combined_21,4363614
40,transactions increase 64 year and year while our sales represented 40 of total sales as it did last year as we,transactions increase 64 year on year while our digital sales represent the market represented 44 of total sales twice as,wrong,whisper-large-v3-turbo,73.0,combined_21,4363614
91.85,sound funding position with a net loans to the of 91.85 1 of the strongest levels since becoming a listed company,sound funding position with a net loan to the positive ratio of 91.8 1 of the strongest levels since becoming,wrong,whisper-large-v3-turbo,91.70731707317074,combined_21,4363614
2000,following the past year economic crisis back in 95 and 2000 and 9 it took 7 quarters for the mexican economy,following the past 2 severe economic crisis back in 1995 and 2009 it took 7 quarters for the mexican economy,wrong,whisper-large-v3-turbo,92.5925925925926,combined_21,4363614
35,almost 3 times that amount almost 44 to 308 from 35 why how could we think this so how should we,a mouth or by 44 to 308 from 252 why i dont think we think this so how should we,wrong,whisper-small,79.48717948717949,combined_21,4364366
2,so for both phosphates and potash we expect relatively normal 2 3 volumes and bold and then for the rest of,so for both phosphate and plot ash we expect relatively normal q3 volumes in both and then for the rest,wrong,whisper-small,93.20388349514563,combined_21,4364366
9.60,revenue second quarter 2020 total digital revenue declined by approximately 9.60 million or 17 reflecting our focus on higher margin profitable,second quarter 2020 total digital revenue declined by approximately 9.6 million or 17 reflecting our focus on higher margin profitable,wrong,whisper-small,99.25373134328358,combined_21,4365024
30,sheet including approximately 665 million in cash as of june 30 with an access to another 180 140 million under our,time nexster has a strong balance sheet including approximately 665 million with an access to another 140 million under our,wrong,whisper-small,87.25490196078431,combined_21,4365024
6,incurred in the quarters both in the quarters and the 6 month period ending june 30 2020 and june 30 201,incurred in the quarters both in the quarters and the sixmonth period ending june 30 2020 and june 30 2019,wrong,whisper-large-v3-turbo,97.11538461538461,combined_21,4365024
57.10,digital and distribution fee revenue of 583.20 million rose approximately 57.10 over the prior year period and 64 of quarterly revenues,distribution fee revenue of 583.2 million rose approximately 57.1 over the prior year period and comprise 64 of quarterly revenues,wrong,whisper-large-v3-turbo,95.65217391304348,combined_21,4365024
20.70,year over year basis in total our sales teams generated 20.70 million of second quarter new to television revenues marking an,year over year basis in total our sales team generated 20.7 million of second quarter newtotelevision revenue marking an 11.3,wrong,whisper-large-v3-turbo,97.95918367346938,combined_21,4365024
31.30,television advertising revenue and distribution fee revenue contribution from nexstars 31.30 ownership stake in television food network and other investments acquired,television advertising revenue and distribution fee revenue contribution from nexstars 31.3 ownership stake in the television food network and other,wrong,GPT-4o mini Transcribe,98.29351535836177,combined_21,4365024
2021,with the whole team about how we continue that into 2021 even if things come back to normal and and covid19,with the whole team about how we continue that into 2 1000 and twenty 1 even if things come back,wrong,whisper-small,90.3954802259887,combined_21,4365948
201,of 13.1 million for the 6 months ended june 31st 201 adjusted free cash flow totaled 18 million for the first,of 13.1 million for the 6 months and the june thirtyfirst 2 1000 and nineteen adjusted free cash flow totaled,wrong,whisper-small,81.86528497409327,combined_21,4365948
25.10,ebit was 27.8 million for the first 6 months for 25.10 unfavorable for the same period in 2019 again mainly due,8 million for the first 6 months or 25.1 unfavorable for the same period in 2019 again mainly due to,wrong,whisper-small,97.48743718592965,combined_21,4365948
27.8,quarter partially offset by reduced operating expenses adjusted ebit was 27.8 million for the first 6 months for 25.10 unfavorable for,quarter partially offset by reduced operating expenses adjusted ebit with twenty 7 point 8 million for the first 6 months,wrong,whisper-small,90.82969432314411,combined_21,4365948
2,during april and may with volumes down 37 during this 2 month period particularly when markets experienced construction restrictions place orders,during aprilmay with volumes down 37 during this twomonth period particularly in markets experience construction restrictions or shelterinplace orders sales,wrong,whisper-small,90.9090909090909,combined_21,4365948
100,the first decision that was made regarding capital allocation the 100 million authorization for the buyback but the overall board once,first decision that was made regarding capital allocation the 1800 million authorization for the buyback but the overall board once,wrong,whisper-large-v3-turbo,99.61685823754789,combined_21,4365948
25.10,ebit was 27.8 million for the first 6 months for 25.10 unfavorable for the same period in 2019 again mainly due,ebit was 27.8 million for the first 6 months or 25.1 unfavorable for the same period in 2019 mainly due,wrong,whisper-large-v3-turbo,95.09803921568627,combined_21,4365948
39.70,were lifted sbms gross margin declined 140 basis points to 39.70 compared to the second quarter of 2019 due to the,were lifted sbms gross margin declined 140 basis points to 39.7 compared to the second quarter of 2019 due to,wrong,whisper-large-v3-turbo,99.08256880733946,combined_21,4365948
0.10,gcp was close to flat year over year at a 0.10 price decline fcc captured price most notably in latin america,was close to flat year over year at a 0.1 price decline sec captured price most notably in latin america,wrong,whisper-large-v3-turbo,97.11538461538461,combined_21,4365948
136.40,turning back specifically to gcp gcps effective tax rate was 136.40 for the quarter that included the reversal of the first,turning back specifically to gcp gcps effective tax rate was 136.4 for the quarter that included the reversal of the,wrong,whisper-large-v3-turbo,99.13793103448276,combined_21,4365948
318.20,to the crisis gcps cash position remains very strong with 318.20 million of cash on the balance sheet at the end,the crisis gcps cash position remains very strong with 318.2 million of cash on the balance sheet at the end,wrong,GPT-4o mini Transcribe,99.07407407407408,combined_21,4365948
12.80,lower selling general and administration costs adjusted ebitda margin was 12.80 for the second quarter or a 100 basis points lower,lower selling general and administration costs adjusted ebitda margin was 12.8 for the second quarter or 100 basis points lower,wrong,GPT-4o mini Transcribe,97.63779527559055,combined_21,4365948
83,of acquisitions you had under contract and now youve closed 83 million post quarter are you still on track to close,of acquisitions you had under contract and now youve closed 82 million postquarter are you still on track to close,wrong,whisper-small,98.24561403508771,combined_21,4366302
8.40,which the biggest recipients were physician offices at more than 8.40 billion hrs operating results for the second quarter were steady,biggest recipients were physician offices at more than 8.4 billion dollars hrs operating results for the second quarter were steady,wrong,whisper-large-v3-turbo,96.47058823529412,combined_21,4366302
1,think that sort of underscores that you know that 5 1 2 range for typical you know mobs and portfolios is,portfolios so i think that sort of underscores that 5 and a half range for typical mobs and portfolios is,wrong,GPT-4o mini Transcribe,84.5360824742268,combined_21,4366302
57.70,profit was 207 million or 42.10 of sales down from 57.70 in the prior year quarter as it is the case,was 207 million or 42.1 of sales down from 57.7 in the prior year quarter as it is the case,wrong,whisper-small,97.8021978021978,combined_21,4366429
