number,gt_snippet,whisper_snippet,type,variant,score,dataset,folder
200000,part of the mark 1 we will provide close to 200000 cubic meters of concrete for the rest of 2021 and,part of the mark 1 where we will provide close to 200 000 cubic meters of concrete for the rest,wrong,whisper-large-v3-turbo,96.17486338797814,combined_22,4469208
30,mean were expecting the market to close to relative to 30 million tons of demand in 2021 and we see further,mean were expecting the market to close to 13 million tons of demand in 2021 and we see further growth,wrong,GPT-4o mini Transcribe,87.25490196078431,combined_22,4469208
40,accelerated economic growth our company has reduced co2 emission by 40 during the last 10 years from the baseline and its,accelerated economic growth our company has reduced co2 emissions by 14 during the last 10 years from the baseline and,wrong,GPT-4o mini Transcribe,98.72340425531915,combined_22,4469208
2023,this means for the the kind of outlook of vs 2023 because you when your policys at least 5 gross in,and what this means for the kind of outlook via 2020free because your policy is at least 5 growth in,wrong,whisper-small,83.15789473684211,combined_22,4469291
2,hi everyone thank you for the pre sentation ive got 2 questions please 1 under dividend if if i got the,hi everyone thank you for the pre sentation questions please 1 on the dividend if i got the wording correctly,wrong,whisper-large-v3-turbo,89.69072164948454,combined_22,4469291
25,in the biases drop in 17 in soy bean and 25 in corn in corn now the current version on hit,in the prices dropping 17 in soybean and 35 in corn 3 of this in common now the current regional,wrong,whisper-small,78.21229050279331,combined_22,4469528
24,giving us a big gain for this year for the 24 2024 too and internal rate of return this farm was,giving us a big gain for this year and for the 20202022 and internal rate of return this farm we,wrong,whisper-small,91.57894736842105,combined_22,4469528
111000,graph similar to the last year 40 14000 paraguay 14000 111000 brazil and 123000 in argentina about the cropters breakdowns the,to the last year 40 14000 paraguay 40000 bolivia ii 11000 brazil and 123000 argentine about the crop breakdowns the,wrong,whisper-small,89.86784140969164,combined_22,4469528
114.000,the same size of the portfolio size of the portfolio 114.000 square meters after selling some properties and with in our,the same size of the portfolio with 114000 square meters after selling some properties and with the inauguration of catalinas,wrong,whisper-large-v3-turbo,87.96296296296296,combined_22,4469528
77.9,did during the december the cubans say service levels of 77.9 the average rent per square meter remains stable at the,did during the december last year the occupancy is at levels of 78.9 the average rent per square meter remains,wrong,whisper-large-v3-turbo,85.44600938967136,combined_22,4469528
2000,in a row the area we are planting now is 2000 2000 262000 hectors around the full country you can see,in a row the area we are planting now is 2 sunset 2 1000 2 100 sixty 2 1000 hectares,wrong,whisper-large-v3-turbo,81.87919463087249,combined_22,4469528
1100,the first trudge and the second trudge will be like 1100 hectors in 2024 so this is a big transaction giving,and the second tranche will be like 1.1 1000 hectares in 2024 so this is a big transaction giving us,wrong,GPT-4o mini Transcribe,91.09947643979058,combined_22,4469528
2500,in 2 steps first step it is more than half 2500 1500 sorry hectors of yo of productive area in the,2 steps first step it is more than half 2.5 1000 1.5 1000 sorry hectares of productive area in the,wrong,GPT-4o mini Transcribe,91.19170984455958,combined_22,4469528
77.9,did during the december the cubans say service levels of 77.9 the average rent per square meter remains stable at the,did during december last year the occupancy is at levels of 78.9 the average rent per square meter remains stable,wrong,GPT-4o mini Transcribe,84.30493273542601,combined_22,4469528
2700,bigger than the first ipo the company did only selling 2700 hectors so a small a look at what is that,bigger than the first ipo the company did only selling 2.7 1000 hectares so a small look at what is,wrong,GPT-4o mini Transcribe,95.38461538461537,combined_22,4469528
14000,see in the graph similar to the last year 40 14000 paraguay 14000 111000 brazil and 123000 in argentina about the,similar to the last year 40000 paraguay 40000 in bolivia too 111000 in brazil and 123000 in argentina about the,wrong,GPT-4o mini Transcribe,88.88888888888889,combined_22,4469528
2022,at this point of time if you look into the 2022 we have our quite optimistic view on health were going,at this point of time if you look into the 2002 we have quite an optimistic view on the health,wrong,whisper-small,92.97297297297298,combined_22,4469590
20,obtainable when we pre pared this release we have repurchased 20 sorry 52000 edrs for circa 3 million this concludes our,brokers report obtainable while we pre pared this release we have repurchased 50000 edrs for circa 3 million this concludes,wrong,whisper-small,92.10526315789474,combined_22,4469590
22,ask what sort of growth outlook are you foresee for 22 for skillus in particular ballpark very wide ranges or directionally,what sort of growth outlook you foresee for 20 to 4 skills in particular ballpark very wide ranges or directionally,wrong,whisper-small,93.04347826086956,combined_22,4469590
200,as a reference in the first half there was a 200 excuse me 20billion upward revision from kioxia equity earnings so,reference in the first half there was a 20 billion upward revision from kioxia equity earnings so we have made,wrong,GPT-4o mini Transcribe,88.18181818181819,combined_22,4469669
2022,we can bring you know all those jobs again to 2022 for many of the jobs they have moving forward to,we can bring you know all those jobs again to 222 for many of the jobs they had moving forward,wrong,whisper-large-v3-turbo,96.80851063829788,combined_22,4469836
91,readjusted as as as you see right below the negative 91 you know you know there was a collection of 90,90 million that we adjusted at utc right below the negative 9 to 1 there was a collection of 19,wrong,GPT-4o mini Transcribe,71.65775401069519,combined_22,4469836
2022,we can bring you know all those jobs again to 2022 for many of the jobs they have moving forward to,how we can bring all those jobs again to 222 or many of the jobs they had moved forward to,wrong,GPT-4o mini Transcribe,85.88235294117648,combined_22,4469836
2000,very hard in 2019 continued work in 2020 and and 2000 2 20 and our agreement with seppi obviously seppi liked,is something we worked very hard in 2019 continue working in 2020 and our agreement with cepi obviously cepi liked,wrong,GPT-4o mini Transcribe,87.0,combined_22,4469836
2021,you see that at especially over 2020 20 and early 2021 the level of awards were near practically nothing and if,pandemic came and you see that especially over 2020 and early 21 the level of awards were nil practically nothing,wrong,GPT-4o mini Transcribe,90.29126213592234,combined_22,4469836
1,have in total 334 000 accounts as you can see 1 of the big accounts are signed up with this program,have in total 334000 accounts as as you can see a lot of the big accounts are signed up for,wrong,whisper-small,92.48554913294798,combined_22,4470010
4,now than 600 billion yen this is summary of our 4 business segments size of the areas shows the size of,now than 600 billion yen this is summary of our full business segment size of the area shows the size,wrong,whisper-small,96.51741293532339,combined_22,4470010
1,have in total 334 000 accounts as you can see 1 of the big accounts are signed up with this program,in total 334000 accounts as you can see a lot of the big accounts are signed up for this program,wrong,whisper-large-v3-turbo,92.63157894736842,combined_22,4470010
100,business trending so first within group we have more than 100 subsidiaries but in a companies looking at the most of,the business trending so first within group we have more than hundreds of subsidiaries and 10 listed companies looking at,wrong,whisper-large-v3-turbo,81.03448275862068,combined_22,4470010
0.03,of the the copper tax is in the range of 0.03 per pound and this is this small growth is mostly,copper tax is in the range of 3 dollar cents per pound and this is this small growth is mostly,wrong,whisper-small,91.01123595505618,combined_22,4470253
165,sales by more than 1 billion from is 1 billion 165 million with with higher copper prices slightly lower silver sales,sales by more than 1 billion from 1 billion 765 million with higher copper prices slightly lower sales and increasing,wrong,whisper-small,92.23744292237444,combined_22,4470253
1900000,and the positive result achieved this year and joint ventures 1900000 000 that is the profit on involvement in joint ventures,result achieved this year and joint ventures 1 billion 900 million that is the profit on involvement in joint ventures,wrong,GPT-4o mini Transcribe,90.2654867256637,combined_22,4470253
1412,operations have made a contribution so thats domestic production from 1412 to 40 440000 tons kghm international 49000 tons to 55000,operations have made a contribution so thats domestic production from 14000 to 40000 tons kghm international 49000 tons to 55000,wrong,GPT-4o mini Transcribe,95.3125,combined_22,4470253
2021,showing up today for a discussion of our third quarter 2021 return in our recent reporting financial returns and performance in,joining us today for the discussion of our third for the next 21 years in addition to reporting financial results,wrong,whisper-small,75.57603686635946,combined_22,4470290
32,a sequential basis regarding the rest of latam colombia was 32 above the third quarter of 2019 pre pandemic levels reflected,rest of the time not worth in colombia was 72 above the third quarter of 2019 pre pandemic levels reflected,wrong,whisper-small,87.87878787878788,combined_22,4470290
510,around lets say 5 on n n n no between 510 no more than that of all the gross bookings were,actually at around lets say 5 between 5 to 10 no more than that of all the gross bookings were,wrong,GPT-4o mini Transcribe,90.69767441860466,combined_22,4470290
12500,respond we are now expecting total sales in 2021 around 12500 metric tons with average sales prices increasing from prices seen,respond we are now expecting total sales in 2021 around 12.5000 magic tons with average sales prices increasing from prices,wrong,whisper-small,97.14285714285714,combined_22,4470570
112000,are expiring this allow us expect an average sales price 112000 per metric ton during the fourth quarter and probably even,are expiring this allows us to expect an average sales price higher than 12000 per metric ton due this is,wrong,whisper-large-v3-turbo,86.17021276595744,combined_22,4470570
100,production of potash at the solar atacama will be between 100 and 150000 tons lower ne from a total level close,production of potash or desalar that a camera would be between and 150000 tons lower it means from a total,wrong,whisper-large-v3-turbo,83.90243902439025,combined_22,4470570
2500,metric tons in the beginning of 2023 followed by approximately 2500 metric tons in 2024 all part of our early growth,metric tons in the beginning of 2023 followed by approximately 2.5 1000 metric tons in 2024 all part of our,wrong,whisper-large-v3-turbo,98.09523809523809,combined_22,4470570
11,on quarter were at 1.5 sequentially accounting for plenty over 11 of total deposits turning to slide 7 2 percentage points,original currency were at 1.5 sequentially accounting for supply 90 over 7 of total deposits turning to slide 7 new,wrong,whisper-small,86.23853211009174,combined_22,4470595
8,attract pre ssure on it turning to quantity on slide 8 our strong and collection policies together with improved economic conditions,exert pre ssure on me turned into us a quantity on 5a our strong anticorruption and collection policies together will,wrong,whisper-small,77.98165137614679,combined_22,4470595
31,rating excluding severance payments on early retirement charges improved to 31 from 72 in the second quarter by its own revenue,ratio excluding non regarding severance payments and early retirement charges improved to 71 this quarter from 72 in the second,wrong,whisper-small,84.58149779735683,combined_22,4470595
347.5,the cost of construction had an increase of 14.3 or 347.5 million its important to remind you that the analysis in,the cost of construction had an increase of 14.3 or 247.5 million its important to remind you that the analysis,wrong,whisper-small,99.09909909909909,combined_22,4470663
582.7,resulting from the increase in opera net operational revenue of 582.7 million which excludes the effects of r revenue and expenses,million resulting from the increase in net operational revenue of 482.7 million which excludes the effects of revenue and expenses,wrong,GPT-4o mini Transcribe,96.03174603174604,combined_22,4470663
26,per share level weve seen growth growth of 135 to 26 3p very pleasing performance indeed net asset value has grown,growth of a 100 and thirtyfive to twentysix 6.3 p very pleasing performance indeed our net asset value has grown,wrong,whisper-small,79.79274611398964,combined_22,4470684
427,vious calls tcc rose by 9 quarter and quarter to 427 pounds in terms of key factors which i would like,vious course tcc are grossed by 9 quarterinquarter to 4.27 per ounce terms of key factors which i would like,wrong,whisper-small,83.74384236453201,combined_22,4471586
10,credit which amounted to 5 in the third quarter versus 10 in the second quarter and also finally a cessation of,5.00 per ounce in the third quarter versus standalone stones in the second quarter and also finally a cessation of,wrong,whisper-small,81.65137614678899,combined_22,4471586
1555,also throughput add the mail reached the racket high of 1555 tonnes per hour in the in the reporting period which,our throughput at the male reached a record high of 15.55 atoms power in the reporting period which is mainly,wrong,whisper-small,77.06422018348624,combined_22,4471586
100,to point out a few important developments required 9 to 100 to 120000 caterpillar trucks for olimpiada during the period and,of point out a few important developments we acquired 9 to 120ton caterpillar trucks for olimpiada during the period and,wrong,whisper-large-v3-turbo,91.66666666666666,combined_22,4471586
690.8,flow from trading activities and this way mainly due to 690.8 million tl increase in our net worth for the period,from operating activities and this way mainly due to 698.8 million tl increase in our net loss for the period,wrong,whisper-large-v3-turbo,93.08755760368663,combined_22,4471606
500,a formation drivers ebitda in the third quarter was negative 500 659.4 million tl compared to positive 8.9 million tl in,of aforementioned drivers ebitda in the third quarter was negative 659.4 million tl compared to positive 8.9 million tl in,wrong,GPT-4o mini Transcribe,95.39748953974896,combined_22,4471606
2022,is explained by savings achieved and partial cost transfer to 2022 with its unique set of competitive advantages lukoil continues to,is explained by the savings achieved and partial cost transfer to 2010 to 2010 with its unique set of competitive,wrong,whisper-small,93.45794392523365,combined_22,4471809
10,2 eurobond tranches with maturities of fi 5.5 years and 10 years for a total of 2.3 billion us dollars this,placed 2 eurobond tranches with materialities of 5.5 years and ten years for a total of 2.3 billion years this,wrong,whisper-small,89.52380952380953,combined_22,4471809
40,60 share while eni holding i wi holds the remaining 40 earlier a successful wells were drilled at block 10 having,60 share while any holding that holds the to meaning for 2 and her successful wells were drilled and blocked,wrong,whisper-small,80.56872037914692,combined_22,4471809
1000,november our spare capacity in russia stood at around 30 1000 barrels per day which means we are close to its,november our spare capacity in josh and josh at around 30000 barrels per day which means we are close to,wrong,whisper-large-v3-turbo,90.38461538461539,combined_22,4471809
2,field is expect to deluge thats question 1 my question 2 is a follow up to karens question on the with,field is expected to be launched thats question 1 my question too is a follow up to karens question on,wrong,whisper-large-v3-turbo,92.3076923076923,combined_22,4471809
100,months doubled year on year free cash flow totaled 2 100 and tw eighte twentytwo billion rubles and more than doubled,months doubled year on year free cash flow totaled 222 billion rubles and more than doubled quarteronquarter this remarkable improvement,wrong,whisper-large-v3-turbo,85.57692307692308,combined_22,4471809
450,a number of up to 400 billion roubles rather than 450 and how much of the cost have been transferred over,number of up to 400 billion rubles rather than 415 and how much of the costs have been transferred over,wrong,GPT-4o mini Transcribe,98.05825242718447,combined_22,4471809
1000,november our spare capacity in russia stood at around 30 1000 barrels per day which means we are close to its,november our spare capacity in russia stood at around 30000 barrels per day which means we are close to its,wrong,GPT-4o mini Transcribe,98.13084112149532,combined_22,4471809
1000,taml5 well with an initial flow rate of over 13 1000 barrels of oil per day as part of the valery,aml5 well with an initial flare rate of over 13000 barrels of oil per day as part of the valery,wrong,GPT-4o mini Transcribe,95.78947368421052,combined_22,4471809
47,for the 9 months the capex exclusion rate was about 47 billion you mentioned several times that the the the the,for the 9 months the cut excluding vat was about 40 billion rubles you mentioned several times that the plan,wrong,whisper-small,87.5,combined_22,4471961
9,3q results so im not looking at the effects for 9 months im just looking at the effects for q3 it,3q results so im not looking at the effects for the months im just looking at this as well q3,wrong,whisper-small,91.32947976878613,combined_22,4471961
2021,that consolidated ebitda will increase 110 billion for the year 2021 in terms of the 6 new power plants in the,that consolidated ebitda will increase 110 billion rubles for the year to in terms of the 6 new power plants,wrong,whisper-small,93.8388625592417,combined_22,4471961
60,net profit for the 3rd quarter of this year reached 60 million zoty as gog posted negative results and net profit,for the third quarter of of this year with 16 million zloty as gog posted negative results and net profit,wrong,whisper-large-v3-turbo,90.38461538461539,combined_22,4472403
3,actually 2 questions so 1 is on the early project 3 stage costs are we going to see those in 2022,questions so 1 is on the early project research phase costs and are we going to see those in 2022,wrong,whisper-large-v3-turbo,89.61748633879782,combined_22,4472403
43.7,our total revenues were 1105.5 million representing an increase of 43.7 year over year primarily due to the rapid growth of,hall our cost of revenues were 1055.1 million representing an increase of 53.2 year over year due to our business,wrong,whisper-small,80.78817733990148,combined_22,4472895
108.9,and development expenses were 6.3 million representing an increase of 108.9 from 3 million in the third quarter of 2020 primarily,and the development expenses were 6.3 million representing an increase of 1 100 and eighty point 9 from 3 million,wrong,whisper-small,86.69950738916256,combined_22,4472895
159,time for q3 the aggregate number of delivery orders were 159 million up 59 year over year this growth rate was,time for q3 the aggregate number of given orders worth 150 million up 59 yearold a year this growth rate,wrong,whisper-small,88.46153846153845,combined_22,4472895
65.1,significant fluctuation of the companys share price some expenses decreased 65.1 to rd 56.5 million equivalent to us dollar 818 million,significant fluctuations of the companys share price selling expenses decreased by 55.1 to rb 56.5 million equivalent to us dollar,wrong,whisper-small,94.0711462450593,combined_22,4473238
139.3,from operations was rd 897.3 million equivalent to us dollar 139.3 million in the 3rd quarter of 2021 compared with rd,income was rmb 976.4 million equivalent to us dollar 151.5 million in the third quarter of 2021 compared to rmb,wrong,whisper-small,86.23853211009174,combined_22,4473238
900,million in the 3rd quarter of 2021 compared with rd 900 979.3 million in the 2nd quarter of 2021 income tax,million in the third quarter of 2021 compared with rmb 979.3 million in the second quarter of 2021 1 income,wrong,whisper-large-v3-turbo,91.42857142857143,combined_22,4473238
419,million in the 3rd quarter of 2021 from positive rd 419 million in the 2nd quarter of 2021 the decrease was,in the third quarter of 2021 from positive rmb 4.9 million in the second quarter of 2021 the decrease was,wrong,whisper-large-v3-turbo,93.13725490196079,combined_22,4473238
65.1,significant fluctuation of the companys share price some expenses decreased 65.1 to rd 56.5 million equivalent to us dollar 818 million,significant fluctuations of the companys share price selling expenses decreased by 55.1 to rb 56.5 million equivalent to us dollar,wrong,whisper-large-v3-turbo,94.0711462450593,combined_22,4473238
818,decreased 65.1 to rd 56.5 million equivalent to us dollar 818 million in february of 2021 from rd in the 2nd,decreased by 55.1 to rb 56.5 million equivalent to us dollar 8.8 million in third quarter of 2021 from rb,wrong,whisper-large-v3-turbo,88.55721393034825,combined_22,4473238
619,808.3 to positive rd 44.6 million equivalent to us dollar 619 million in the 3rd quarter of 2021 from positive rd,808.3 to positive rmb 44.6 million equivalent to us6 9 million in the third quarter of 2021 from positive rmb,wrong,GPT-4o mini Transcribe,89.90825688073394,combined_22,4473238
419,million in the 3rd quarter of 2021 from positive rd 419 million in the 2nd quarter of 2021 the decrease was,in the third quarter of 2021 from positive rmb 4.9 million in the second quarter of 2021 the decrease was,wrong,GPT-4o mini Transcribe,93.13725490196079,combined_22,4473238
120,a guess at at that secondly with flight theres a 120 million of low or zero margin program revenue in that,at that secondly we flagged theres a 100 and twenty million of low or zero margin program revenue in that,wrong,whisper-small,88.0,combined_22,4473837
400,wed have that we couldnt do the deals for the 400 million in euro i wasnt certain wed have the cash,that wed have the deals for the 4 100 million in a year that wed have to cash so i,wrong,whisper-small,74.68354430379746,combined_22,4473837
51,79 of our import containers are late an average of 51 days a few percentage of those are actually a few,import containers are late by an average of fifty 1 days a few percentage of those are actually a few,wrong,whisper-small,94.84536082474226,combined_22,4474506
3,now recognizing with contracts we might do 1 2 and 3 year contracts so were still benefiting on 3 year stuff,now recognizing with contracts we might do 1 2 and threeyear contracts so were still benefiting on threeyear stuff and,wrong,whisper-small,91.34615384615384,combined_22,4474506
60,at this point a little over 50 a little under 60 its its about 50 in the us and canada which,at this point point okay thats a little under 50 us its about 50 in the us and canada which,wrong,whisper-small,84.61538461538461,combined_22,4474506
1.696,in the first quarter was up 19 coming in at 1.696 billion this year compared in the first quarter of last,in the first quarter increased 18 coming in at 1.693 billion this year in the quarter compared to 1.43 billion,wrong,GPT-4o mini Transcribe,80.82901554404145,combined_22,4474506
65,a 100 basis points of improvement year over year at 65 basis points last quarter now fully realizing the comps on,100 basis points of improvement year over year at and a new 1 that had a small impact in q1,wrong,GPT-4o mini Transcribe,73.93939393939394,combined_22,4474506
100,transactions our cost of revenues decreased by 47.4 to rmb 100 and and 4.6 million from rmb 198.8 million for the,merchandise credit transactions our cost of revenues decreased by 47.4 to maybe 104.6 million but maybe 198.8 million for the,wrong,whisper-small,88.58447488584476,combined_22,4474955
64.8,decreased by 49.3 to rmb 32.9 million from rmb 6 64.8 million for the third quarter of last year primarily due,decreased by 49.3 to rb 32.9 million farmer would be 60 of 4.8 million for the third quarter of last,wrong,whisper-small,90.05235602094241,combined_22,4474955
100,transactions our cost of revenues decreased by 47.4 to rmb 100 and and 4.6 million from rmb 198.8 million for the,merchandise credit transactions our cost of revenues decreased by 47.4 to rmb 104.6 million for maybe 198.8 million for the,wrong,whisper-large-v3-turbo,92.16589861751152,combined_22,4474955
14.4,quarter and our onbalance sheet loan balance decreased sequentially by 14.4 to 3 billion rmb during the quarter we continued to,and our own balance sheet loan balance decreases officially by 40.4 to 3 billion rmb during the quarter we continued,wrong,whisper-large-v3-turbo,92.24137931034483,combined_22,4474955
100,transactions our cost of revenues decreased by 47.4 to rmb 100 and and 4.6 million from rmb 198.8 million for the,merchandise credit transactions our cost of revenues decreased by 47.4 to rmb 104.6 million from rmb 198.8 million for the,wrong,GPT-4o mini Transcribe,95.37037037037037,combined_22,4474955
